id,title,contentEn,contentSw,needs_translation
disease-urinary-kidney-problems,Kidney Problems,"TREATMENT
• Eat 75% raw foods, including garlic, parsley, potatoes, celery, cucumbers, and bananas.
Green vegetables are especially important.
• Stop eating meat. An excess of protein is part of your problem; and meat also has a
variety of waste products, plus bacteria, purines, and uric acid.
• Avoid dairy products, except yogurt. Do not eat chocolate or cocoa.
• Drink 6-8 ounces of distilled water every hour.
• Watermelon and pumpkin seeds seem to help the kidneys, although the reason is not
known.
• Corn-silk tea is the best single herb for increasing urine flow and restoring the kidneys.
Watermelon-seed tea and celery and parsley seeds are also diuretic in function.
• Cranberries help acidify the urine, destroy bacteria, and restore the bladder.
• Do not eat much potassium or phosphorous. For this reason, avoid beet greens, spinach,
rhubarb, and Swiss chard.
• Lead, other metals, the pain relieving drugs (Advil, Nuprin, etc.), and infectious diseases
(scarlet fever, measles, etc.) can damage the kidneys. Spirulina is known to reduce kidney
poisoning that is caused by mercury and drugs.
PROBLEMS AND CAUSES—In addition to other conditions mentioned in this section on the kidneys,
there are less known diseases which can be just as serious. These include:
Renal tubular acidosis: The kidneys fail to reabsorb bicarbonate properly, resulting in inadequate
ammonia production and acid excretion. This leads to a severe lack of fluid and potassium in the body,
and an excess of acidity. The bones can become deranged.
Hydronephrosis: The kidneys and bladder become filled with urine, due to obstruction of the flow.
Glomerulonephritis: This is an inflammation of the tiny kidney filtering units, sometimes resulting from
a bacterial infection in the body.
Uremia: A toxic waste buildup in the blood, due to kidney malfunction.
In all of these conditions, a basic need is to cleanse the kidneys, increase urine flow, and restore proper
function.","Matibabu
• Kula vyakula mbichi 75%, pamoja na vitunguu, parsley, viazi, celery, matango, na ndizi.
Mboga ya kijani ni muhimu sana.
• Acha kula nyama. Kuzidi kwa protini ni sehemu ya shida yako; na nyama pia ina
Aina ya bidhaa za taka, pamoja na bakteria, purines, na asidi ya uric.
• Epuka bidhaa za maziwa, isipokuwa mtindi. Usila chokoleti au kakao.
• Kunywa ounces 6-8 za maji yaliyosafishwa kila saa.
• Mbegu za tikiti na malenge zinaonekana kusaidia figo, ingawa sababu sio
inayojulikana.
• Chai ya kumwagika kwa mahindi ni mimea bora moja kwa kuongeza mtiririko wa mkojo na kurejesha figo.
Chai ya mbegu za mbegu na mbegu za celery na mbegu za parsley pia zinafanya kazi.
• Cranberries husaidia asidi ya mkojo, kuharibu bakteria, na kurejesha kibofu cha mkojo.
• Usila potasiamu nyingi au fosforasi. Kwa sababu hii, epuka mboga za beet, mchicha,
Rhubarb, na Uswisi Chard.
• Kuongoza, metali zingine, dawa za kupunguza maumivu (Advil, Nuprin, nk), na magonjwa ya kuambukiza
(Homa ya Scarlet, surua, nk) inaweza kuharibu figo. Spirulina inajulikana kupunguza figo
sumu ambayo husababishwa na zebaki na dawa za kulevya.
Shida na sababu -kwa kuongeza hali zingine zilizotajwa katika sehemu hii kwenye figo,
Kuna magonjwa yasiyojulikana ambayo yanaweza kuwa mazito tu. Hii ni pamoja na:
Acidosis ya Tubular Acidosis: figo hushindwa kurudisha bicarbonate vizuri, na kusababisha kutotosha
Uzalishaji wa Amonia na excretion ya asidi. Hii husababisha ukosefu mkubwa wa maji na potasiamu mwilini,
na ziada ya acidity. Mifupa inaweza kupunguka.
Hydronephrosis: figo na kibofu cha mkojo hujazwa na mkojo, kwa sababu ya kizuizi cha mtiririko.
Glomerulonephritis: Huu ni uchochezi wa vitengo vidogo vya kuchuja vya figo, wakati mwingine hutokana na
maambukizi ya bakteria mwilini.
Uremia: Kujengwa kwa taka zenye sumu kwenye damu, kwa sababu ya utendakazi wa figo.
Katika hali hizi zote, hitaji la msingi ni kusafisha figo, kuongeza mtiririko wa mkojo, na kurejesha sahihi
kazi.",yes
disease-urinary-renal-colic,Renal Colic,"TREATMENT
• Drink plenty of pure water. Avoid coffee, alcohol, and artificial drinks.
• Drinking unsweetened cranberry juice and apple juice helps reduce bacterial growth in
the kidneys.
• Carrot, celery, and parsley juice is also helpful.
• Eat nourishing food, and avoid processed and junk food.
• Include enough vitamins C, A, and B complex in the diet. Potassium deficiencies can
encourage kidney problems.
• Go on a 3-day cleansing water-and-juice fast. Take enemas and rest. Keep the fluid level
high.
• Helpful herbs include garlic, echinacea, burdock, red clover, and goldenseal. Also of
value: juniper berries, parsley, and watermelon-seed tea. Buchu tea and marshmallow tea
are most helpful.
• Used in conjunction with more fluid intake, corn-silk tea has been used for hundreds of
years to increase urine output, a very necessary factor in purifying and detoxifying the
kidneys.
- Also see ""Cystitis"" (infection of the bladder). The two are closely associated in health
and in sickness. Also see ""Bright's Disease,"" which is a variant form of nephritis.
—Also see ""Nephritis—2.""
(Kidney Pain Attack) (J.H. Kellogg, M.D., Formulas)
DURING ATTACK—Rest in bed; diet of fruit; buttermilk; hot water drinking; Hot Enema, repeat
every 2 hours; Hot Full Bath with cold to head and over heart, if bath is greatly prolonged; Hot Trunk
Pack renewed hourly; Revulsive Sitz Bath; Cold Compress over heart, if it is weak or much excited.
TO PREVENT ATTACKS—Combat lithemia.
VOMITING—Ice pills, ice to throat.
URINARY SUPPRESSION—Hot Blanket Pack followed by Dry sweating Pack.
—Also see ""Kidney Stones—1 and Kidney Stones—2.""
NEPHRITIS—1
(Kidney Infection)
SYMPTOMS—There may be no symptoms or they may include blood and/or albumin in the urine and
lower back, abdominal pain, even chills, fatigue, edema, nausea and vomiting, frequent urge to urinate,
and loss of appetite. Severe cases may include anemia and high blood pressure.
CAUSES—This is inflammation of one or both kidneys. Thousands of tiny cells in the kidneys filter
fluids out of the blood in order to purify it. But the filter can become plugged with toxins and mucous.
When these tiny cells become swollen and inflamed, infection soon follows.
This infection can be acute or chronic, and may require hospitalization.
Constipation causes a toxic matter to be reabsorbed by the blood. This clogs the kidneys.
Overuse of aspirin and other pain killers weaken the kidneys; beer can cause their failure. Environmental
toxins, such as heavy metals, add to the damage. Anti-hypertensive drugs are used to reduce blood
circulation, and therefore injure the kidneys.
Kidney infection can also be caused by bacterial infection in the bladder (cystitis, which see) which has
traveled up the ureters to the kidneys.","Matibabu
• Kunywa maji mengi safi. Epuka kahawa, pombe, na vinywaji bandia.
• Kunywa juisi ya cranberry isiyo na maji na juisi ya apple husaidia kupunguza ukuaji wa bakteria katika
figo.
• Karoti, celery, na juisi ya parsley pia inasaidia.
• Kula chakula chenye lishe, na epuka kusindika na chakula kisicho na chakula.
• Jumuisha vitamini C, A, na B tata katika lishe. Upungufu wa potasiamu unaweza
Kuhimiza shida za figo.
• Nenda kwenye maji ya siku 3 ya kusafisha maji-na-juisi haraka. Chukua enemas na kupumzika. Weka kiwango cha maji
juu.
• Mimea inayosaidia ni pamoja na vitunguu, echinacea, burdock, clover nyekundu, na dhahabu. Pia ya
Thamani: Berries za Juniper, Parsley, na chai ya Mbegu-Mbegu. Chai ya Buchu na chai ya Marshmallow
zinasaidia sana.
• Kutumika kwa kushirikiana na ulaji zaidi wa maji, chai ya kunyoa ya mahindi imetumika kwa mamia ya
miaka ya kuongeza pato la mkojo, jambo muhimu sana katika utakaso na detoxifying
figo.
- Pia tazama ""cystitis"" (maambukizi ya kibofu cha mkojo). Wawili hao wanahusishwa sana na afya
na katika ugonjwa. Pia angalia ""Ugonjwa wa Bright,"" ambayo ni aina tofauti ya nephritis.
-Unaona ""Nephritis -2.""
(Shambulio la maumivu ya figo) (J.H. Kellogg, M.D., formula)
Wakati wa shambulio -kupumzika kitandani; lishe ya matunda; buttermilk; kunywa maji ya moto; Enema ya moto, rudia
kila masaa 2; Bafu kamili ya moto na baridi hadi kichwa na moyo, ikiwa umwagaji ni wa muda mrefu sana; Shina moto
Pakiti upya saa; Bafu ya Sitz ya Kurudisha; Compress baridi juu ya moyo, ikiwa ni dhaifu au msisimko sana.
Ili kuzuia mashambulio -combat lithemia.
Kutapika -dawa za barafu, barafu kwa koo.
Kukandamiza mkojo -pakiti ya blanketi ikifuatiwa na pakiti kavu ya jasho.
-Unaona ""Mawe ya figo - 1 na mawe ya figo - 2.""
Nephritis -1
(Maambukizi ya figo)
Dalili -haziwezi kuwa na dalili au zinaweza kujumuisha damu na/au albin kwenye mkojo na
Chini ya chini, maumivu ya tumbo, hata baridi, uchovu, edema, kichefuchefu na kutapika, hamu ya mara kwa mara ya kukojoa,
na kupoteza hamu ya kula. Kesi kali zinaweza kujumuisha anemia na shinikizo la damu.
Sababu - hii ni kuvimba kwa figo moja au zote mbili. Maelfu ya seli ndogo kwenye kichujio cha figo
maji nje ya damu ili kuitakasa. Lakini kichujio kinaweza kushonwa na sumu na mucous.
Wakati seli hizi ndogo zinakuwa kuvimba na kuwashwa, maambukizi hufuata hivi karibuni.
Uambukizi huu unaweza kuwa wa papo hapo au sugu, na unaweza kuhitaji kulazwa hospitalini.
Kuvimbiwa husababisha jambo lenye sumu kutolewa tena na damu. Hii hufunika figo.
Matumizi mabaya ya aspirini na wauaji wengine wa maumivu hudhoofisha figo; Bia inaweza kusababisha kutofaulu kwao. Mazingira
Sumu, kama vile metali nzito, ongeza kwenye uharibifu. Dawa za kupambana na shinikizo la damu hutumiwa kupunguza damu
mzunguko, na kwa hivyo kuumiza figo.
Maambukizi ya figo pia yanaweza kusababishwa na maambukizi ya bakteria kwenye kibofu cha mkojo (cystitis, ambayo huona) ambayo ina
Alisafiri kwa ureters kwa figo.",yes
disease-urinary-bladder-problems,Bladder Problems,"TREATMENT
• Increase the fluid intake—lots of water, especially distilled, is best. Drink a half pint
every 20 minutes for 3 hours, then one cup every hour. This is important.
• Also drink cranberry juice. When you have this problem, citrus juice is not as good,
since it tends to make the urine more alkaline, encouraging bacterial growth.
• Eat a nourishing diet; avoid the wrong foods. See ""Nephritis"" (kidney infection) for
much more information on the proper care and healing of the urinary tract. The bladder
and kidneys are closely associated; whatever helps one helps the other.
• Acidify the urine by drinking 1-2 quarts of cranberry juice per day, for the first day, and
1 quart a day thereafter while the crisis continues.
• Helpful herbs include juniper, lovage, parsley, uva ursi, rupturewort, bearberry, birch,
and prickly restharrow. Of course, do not add sweetener or milk to the tea.
• Drink tea made from 2-3 crushed or blended garlic bulbs several times a day.
• The use of aluminum cookware is another cause of cystic symptoms. Avoid zinc and
iron supplements until this problem is healed.
• Potassium deficiencies can lead to renal (kidney) disorders.
• To relieve the pain and encourage healing, take hot sitz (sitting) baths twice a day, for 20
minutes. To one of those daily sitz baths, add 1 cup of vinegar. The next day, add 2 cloves
crushed garlic or garlic juice to the water of one of the two baths.
• A hot water bottle placed in direct contact to the urethral and vaginal openings may be
extremely helpful in reducing pain. A heat lamp can also be used.
• Women should especially avoid bacterial infection ascending into the bladder: The
urinary outlet of the urethra is close to the vagina. When sexual intercourse is not done
with clean hands or too frequently, germs are more likely to enter the urethra. Wipe from
front to back following bowel movements, urinate before and after intercourse, and wear
cotton underclothing (it lets air through and absorbs moisture better). Avoid douches,
hygiene sprays, bubble baths, soap in the bath water, and nylon clothing. Wash carefully
during the monthly, to avoid bacteria from going up the urethra. Do not use tampons if
there are frequent urinary tract infections. Rinse underwear well, to get all the soap out.
Boil panties in plain water. Shower after bathing in a swimming pool. Dress to keep the
extremities warm; cold extremities weaken the trunk organs, including the urinary tract.
Birth control pills and spermaticides may cause cystitis.
—See ""Cystitis—2.""
HYDRO—Here are several hydrotherapy applications found in the author's book, Water Therapy
Manual (see order sheet):
Bladder atony: Ascending Douche. This is a jet or spray directed upward, in this case, against the
perineum (p. 159). Abdominal Douche (a spray to the front of the abdomen only (p. 165).
Bladder inflammation: Copious water drinking. Revulsive Sitz Bath, twice a day; Hot Leg Packs,
followed by dry heat (Radiant Heat Bath) to legs; Neutral Bath 20-40 minutes, 2-3 times a week;
Prolonged Neutral Sitz Bath; Cold Mitten Friction; Cold Towel Rub; Fomentation over bladder, Hot
Enema; Hot Pelvic Pack; Aseptic Dietary (p. 180).
Irritable bladder: When inflammation is not present, give a Very Hot Sitz Bath for 5 minutes, followed
by Neutral Sitz Bath for 10-20 minutes. Hot pack to pelvis, Heating Compress over perineum and
genitals, Revulsive Sitz, and Hot Colonic (p. 180).
Bladder insufficiency: Spinal (Dorsal) Douche. This is a hand-held hosing of water to the dorsal (upper
and central) part of the spine. The stream should be allowed to play rapidly up and down, extending 3-4
inches on either side of the spine. Give tepid water for irritability of the bladder (when of spinal origin).
Give a Cold Spinal Douche for motor insufficiency of the bladder, resulting in urinary incontinence or
retention (p. 160).
Bladder paresis (paralysis): Daily colonic. Cold Plantar Douche, that is, to bottom of feet (p. 219).
Bladder retention: Lumbar Revulsive Douche. This spray should be hot, and then very brief cold, and
will help alleviate urinary retention, due to spasm in the neck of the bladder (p. 161).","Matibabu
• Ongeza ulaji wa maji -mengi ya maji, haswa yaliyojaa, ni bora. Kunywa pint nusu
Kila dakika 20 kwa masaa 3, kisha kikombe kimoja kila saa. Hii ni muhimu.
• Pia kunywa juisi ya cranberry. Unapokuwa na shida hii, juisi ya machungwa sio nzuri,
Kwa kuwa inaelekea kufanya mkojo zaidi, kuhamasisha ukuaji wa bakteria.
• Kula lishe yenye lishe; Epuka vyakula vibaya. Tazama ""Nephritis"" (maambukizi ya figo) kwa
Habari zaidi juu ya utunzaji sahihi na uponyaji wa njia ya mkojo. Kibofu cha mkojo
na figo zinahusishwa sana; Chochote kinachosaidia mtu husaidia mwingine.
• Tafuta mkojo kwa kunywa lita 1-2 za juisi ya cranberry kwa siku, kwa siku ya kwanza, na
1 Quart kwa siku baadaye wakati shida inaendelea.
• Mimea inayosaidia ni pamoja na Juniper, Lovage, Parsley, Uva Ursi, Rupturewort, Bearberry, Birch,
na prickly restharrow. Kwa kweli, usiongeze tamu au maziwa kwenye chai.
• Kunywa chai iliyotengenezwa kutoka kwa balbu 2-3 zilizokandamizwa au zilizochanganywa mara kadhaa kwa siku.
• Matumizi ya cookware ya alumini ni sababu nyingine ya dalili za cystic. Epuka zinki na
virutubisho vya chuma hadi shida hii iponywe.
• Upungufu wa potasiamu unaweza kusababisha shida ya figo (figo).
• Ili kupunguza maumivu na kuhimiza uponyaji, chukua bafu za moto (kukaa) mara mbili kwa siku, kwa 20
dakika. Kwa moja ya bafu za kila siku za Sitz, ongeza kikombe 1 cha siki. Siku inayofuata, ongeza karafuu 2
Vitunguu vilivyoangamizwa au juisi ya vitunguu kwa maji ya moja ya bafu mbili.
• chupa ya maji ya moto iliyowekwa katika mawasiliano ya moja kwa moja na fursa za uke na uke zinaweza kuwa
inasaidia sana kupunguza maumivu. Taa ya joto pia inaweza kutumika.
• Wanawake wanapaswa kuzuia hasa maambukizi ya bakteria yanayopanda kwenye kibofu cha mkojo: The
Uuzaji wa mkojo wa urethra uko karibu na uke. Wakati ngono haijafanywa
Kwa mikono safi au mara nyingi, vijidudu vina uwezekano mkubwa wa kuingia kwenye urethra. Futa kutoka
Mbele ya nyuma kufuatia harakati za matumbo, mkojo kabla na baada ya kujuana, na kuvaa
Pamba chini ya kufunika (inaruhusu hewa kupitia na inachukua unyevu bora). Epuka douches,
Mafuta ya usafi, bafu za Bubble, sabuni kwenye maji ya kuoga, na mavazi ya nylon. Osha kwa uangalifu
Wakati wa kila mwezi, kuzuia bakteria kutoka kwa urethra. Usitumie tampons ikiwa
Kuna maambukizo ya njia ya mkojo ya mara kwa mara. Suuza chupi vizuri, ili kupata sabuni yote.
Chemsha suruali katika maji wazi. Oga baada ya kuoga katika dimbwi la kuogelea. Mavazi ya kuweka
miingiliano joto; Vizuizi baridi hudhoofisha viungo vya shina, pamoja na njia ya mkojo.
Vidonge vya kudhibiti uzazi na manii inaweza kusababisha cystitis.
-Tazama ""cystitis -2.""
Hydro - Hapa kuna matumizi kadhaa ya hydrotherapy yanayopatikana kwenye kitabu cha mwandishi, Tiba ya Maji
Mwongozo (tazama karatasi ya kuagiza):
Kibofu cha mkojo: douche inayopanda. Hii ni ndege au dawa iliyoelekezwa zaidi, katika kesi hii, dhidi ya
perineum (uk. 159). Douche ya tumbo (dawa ya mbele ya tumbo tu (uk. 165).
Kuvimba kwa kibofu cha mkojo: Kunywa kwa maji mengi. Bafu ya Sitz ya Kurudisha, mara mbili kwa siku; Pakiti za mguu moto,
ikifuatiwa na joto kavu (umwagaji wa joto la radi) kwa miguu; Umwagaji wa upande wowote dakika 20-40, mara 2-3 kwa wiki;
Baa ya muda mrefu ya Sitz; Msuguano wa baridi ya Mitten; Taulo baridi kusugua; Fomentation juu ya kibofu cha mkojo, moto
Enema; Pakiti ya pelvic moto; Lishe ya Aseptic (uk. 180).
Kibofu kisichokasirika: Wakati uchochezi haupo, toa bafu ya moto sana kwa dakika 5, ikifuatiwa
na umwagaji wa sitz kwa dakika 10-20. Pakiti moto kwa pelvis, inapokanzwa compress juu ya perineum na
Sehemu za siri, Sitz inayobadilisha, na Colon ya Moto (uk. 180).
Ukosefu wa kibofu cha mkojo: mgongo (dorsal) douche. Hii ni hosing iliyoshikiliwa kwa mkono kwa dorsal (juu
na katikati) sehemu ya mgongo. Mkondo unapaswa kuruhusiwa kucheza haraka juu na chini, kupanua 3-4
inchi pande zote za mgongo. Toa maji tepid kwa kuwashwa kwa kibofu cha mkojo (wakati wa asili ya mgongo).
Toa douche baridi ya mgongo kwa ukosefu wa kibofu cha kibofu cha mkojo, na kusababisha kukomesha kwa mkojo au
Kuhifadhi (uk. 160).
Paresis ya kibofu cha mkojo (kupooza): koloni ya kila siku. Douche baridi ya mmea, ambayo ni, chini ya miguu (uk. 219).
Uhifadhi wa kibofu cha mkojo: Douche ya Lumbar Repulsive. Dawa hii inapaswa kuwa moto, na kisha baridi fupi sana, na
itasaidia kupunguza utunzaji wa mkojo, kwa sababu ya spasm kwenye shingo ya kibofu cha mkojo (uk. 161).",yes
disease-urinary-autism,Autism,"TREATMENT
• Dr. Bernard Rimland, a research psychologist in San Diego, found that 50% of his
patients improved when placed on a megavitamin therapy.
• The vitamins which especially helped were niacin (use as niacinamide), pantothenic
acid, B and C. When improvement did not occur, additional B was given, along with
6 6
magnesium, to offset the B , and then improvement was seen.
6
• As soon as the vitamin therapy ceased, the symptoms returned.
• As a result of vitamin therapy, there was a reduction in tantrums, improved speech,
better sleep patterns, increased alertness, and greater sociability.
• Allan Cott, M.D., a New York psychiatrist, gave 200 mg of pangamic acid to autistic
children, and decided improvement frequently occurred.
• Give a nourishing diet high in vitamins and minerals.
• The diet should be high fiber, of 50-75% raw fruits and vegetables.
• No junk, processed, sugar, dairy, wheat, or white-flour foods of any kind should be
given. Avoid fried and fatty foods and most meats.
• Regular, moderate, exercise is important.
• Use an elimination diet, to test for food allergies (see ""Allergies"" and ""Pulse Test"").
SYMPTOMS—Symptoms are very obvious before the age of three: A marked unresponsiveness to
other people and surroundings, indifferent to affection, and withdrawn into themselves.
Sometimes strange actions, such as pounding feet while sitting, continual rocking back and forth, silent
sitting for long periods of time, bursts of hyperactivity while they bite, or pound, on their bodies.
CAUSES—There are about 100,000 autistic children in America. They look normal in appearance; but,
in addition to the above symptoms, they have learning disabilities and are often mentally disabled. A
rare few have astounding abilities in mathematics or music.
Nutritional improvement appears to be the best route for natural treatment.
In some instances, autistic children have recovered, usually during adolescence. Some progress well, and
later lose what was gained.
If you have an autistic child, give him a high B-complex supplementation, plus other nutritional factors.","Matibabu
• Dk. Bernard Rimland, mwanasaikolojia wa utafiti huko San Diego, aligundua kuwa 50% yake
Wagonjwa waliboresha wakati wamewekwa kwenye tiba ya megavitamin.
• Vitamini ambavyo vilisaidia sana ni niacin (tumia kama niacinamide), pantothenic
asidi, b na c. wakati uboreshaji haukutokea, nyongeza ya b ilipewa, pamoja na
6 6
Magnesiamu, kumaliza B, na kisha uboreshaji ulionekana.
6
• Mara tu tiba ya vitamini ilipokoma, dalili zilirudi.
• Kama matokeo ya tiba ya vitamini, kulikuwa na kupunguzwa kwa ghadhabu, hotuba iliyoboreshwa,
Njia bora za kulala, tahadhari iliyoongezeka, na ujamaa mkubwa.
• Allan Cott, M.D., mtaalam wa akili wa New York, alitoa 200 mg ya asidi ya pangamic kwa autistic
watoto, na kuamua uboreshaji mara nyingi ulitokea.
• Toa lishe yenye lishe kubwa katika vitamini na madini.
• Lishe inapaswa kuwa nyuzi nyingi, ya matunda na mboga 50-75%.
• Hakuna chakula, kusindika, sukari, maziwa, ngano, au vyakula vyeupe vya aina yoyote vinapaswa kuwa
kutolewa. Epuka vyakula vya kukaanga na vyenye mafuta na nyama nyingi.
• Mara kwa mara, wastani, mazoezi ni muhimu.
• Tumia lishe ya kuondoa, kujaribu mzio wa chakula (angalia ""mzio"" na ""mtihani wa kunde"").
Dalili -Symptoms ni dhahiri sana kabla ya umri wa miaka mitatu: Kutokujali kwa alama
Watu wengine na mazingira, bila kujali mapenzi, na kujiondoa wenyewe.
Wakati mwingine vitendo vya kushangaza, kama vile miguu ya kusukuma wakati umekaa, ukitikisa kila wakati nyuma na mbele, kimya
Kukaa kwa muda mrefu, kupasuka kwa shida wakati wanauma, au pound, kwenye miili yao.
Sababu -Kuna watoto wapatao 100,000 huko Amerika. Wanaonekana kawaida kwa kuonekana; lakini,
Mbali na dalili hapo juu, wana ulemavu wa kujifunza na mara nyingi huwa walemavu kiakili. A
Wachache wachache wana uwezo wa kushangaza katika hesabu au muziki.
Uboreshaji wa lishe unaonekana kuwa njia bora ya matibabu ya asili.
Katika visa vingine, watoto wa Autistic wamepona, kawaida wakati wa ujana. Baadhi huendelea vizuri, na
baadaye kupoteza kile kilichopatikana.
Ikiwa una mtoto wa kawaida, mpe nyongeza ya juu ya B-tata, pamoja na sababu zingine za lishe.",yes
