id,title,contentEn,contentSw,needs_translation
disease-musculoskeletal-temporomandibular-joint-syndrome,Temporomandibular Joint Syndrome,"TREATMENT
• Hot and cold (or hot or cold) packs will help relieve pain in the neck and shoulders.
• A diet rich in the B complex is important. Also calcium, magnesium, silicon, zinc,
lecithin, and flaxseed oil.
• Avoid sugar foods, which deplete calcium and other minerals.
• Avoid smoking and do not eat meat.
• Learn to relax and avoid stressful thinking or situations.
• If you sit a lot, relax and maintain good posture. Do not hunch over and strain.
• Do not sleep on your side or lie on your side with your head turned to the side.
• Do not prop your head at an angle (especially in bed) when reading, talking, or watching
television.
• Do not chew bits of food when the meal is over. Do not chew gum.
• Fast once a month, to give the body and jaws a rest so rebuilding can take place.
• Orthodontists, dentists, physical therapists, and other specialists offer treatments for
TMJ. But it is estimated that 90% of all cases respond well to simple, inexpensive,
treatments.
• Rheumatoid arthritis (which see) can also cause jaw pain.
—It is important that you also read ""Bruxism."" Also read ""Bones, Strengthening,"" to help maintain and
rebuild strong bones.
(TMJ)
SYMPTOMS—Pain in the muscles and joints of the jaws, which can radiate to the face and neck. There
is a frequent clenching of the jaws.
Possible headache, toothaches, dizziness, pain and ringing in the ears, and pressure behind the eyes
When eating or yawning, there is a clicking, grinding, and popping noise, and perhaps pain. There may
be difficulty in opening and closing the jaws.
CAUSES—The bite is misaligned, either as a cause of the jaw problem or as an effect. The cartilage
disk that cushions the joint becomes damaged. This causes the bones of the temporomandibular joint to
rub against one another instead of gliding smoothly past each other. If the tooth repair or replacements
have not been done properly, this can be a factor in causing the problem.
Stress, a poor bite, and bruxism are the most frequent causes. Some people develop the habit of
clenching their teeth together during the day and/or at night. Called bruxism (which see), this is very
hard on the joint in the jaw.
An injury, poor dental work, osteoarthritis, bad posture, repeated or hard blows to the jaw or chin,
whiplash, gum chewing, thumb sucking, chewing on only one side of the mouth, or holding the phone
between the shoulder and jaw.","Matibabu
• Pakiti za moto na baridi (au moto au baridi) zitasaidia kupunguza maumivu kwenye shingo na mabega.
• Lishe iliyo na tata ya B ni muhimu. Pia kalsiamu, magnesiamu, silicon, zinki,
Lecithin, na mafuta ya kitani.
• Epuka vyakula vya sukari, ambavyo hukamilisha kalsiamu na madini mengine.
• Epuka kuvuta sigara na usile nyama.
• Jifunze kupumzika na epuka mawazo yanayofadhaisha au hali.
• Ikiwa unakaa sana, pumzika na kudumisha mkao mzuri. Usichukue juu na ugumu.
• Usilale upande wako au uongo upande wako na kichwa chako kimegeuka upande.
• Usipendekeze kichwa chako kwa pembe (haswa kitandani) wakati wa kusoma, kuzungumza, au kutazama
Televisheni.
• Usitafute chakula wakati chakula kimekwisha. Usitafute gum.
• Haraka mara moja kwa mwezi, kutoa mwili na taya kupumzika ili kujenga tena iweze kuchukua nafasi.
• Orthodontists, madaktari wa meno, wataalamu wa mwili, na wataalamu wengine hutoa matibabu kwa
TMJ. Lakini inakadiriwa kuwa 90% ya kesi zote hujibu vizuri kwa rahisi, bei ghali,
matibabu.
• Arthritis ya rheumatoid (ambayo huona) inaweza pia kusababisha maumivu ya taya.
-Ni muhimu kwamba pia usome ""Bruxism."" Soma pia ""Mifupa, Kuimarisha,"" kusaidia kudumisha na
Kuunda tena mifupa yenye nguvu.
(TMJ)
Dalili -Pain kwenye misuli na viungo vya taya, ambazo zinaweza kuangaza kwa uso na shingo. Huko
ni mara kwa mara kunyoa kwa taya.
Maumivu ya kichwa yanayowezekana, maumivu ya meno, kizunguzungu, maumivu na kupigia masikioni, na shinikizo nyuma ya macho
Wakati wa kula au kuandama, kuna kubonyeza, kusaga, na kelele za kupiga kelele, na labda maumivu. Kuna Mei
Kuwa ugumu wa kufungua na kufunga taya.
Sababu -kuuma huwekwa vibaya, ama kama sababu ya shida ya taya au kama athari. Cartilage
Disk ambayo matakia ya pamoja inaharibiwa. Hii husababisha mifupa ya pamoja ya temporomandibular kwa
Kusugua dhidi ya mwenzake badala ya kuteleza vizuri kila mmoja. Ikiwa ukarabati wa jino au uingizwaji
Haijafanywa vizuri, hii inaweza kuwa sababu ya kusababisha shida.
Dhiki, kuuma duni, na bruxism ndio sababu za mara kwa mara. Watu wengine huendeleza tabia ya
Kufunga meno yao pamoja wakati wa mchana na/au usiku. Inaitwa Bruxism (ambayo huona), hii ni sana
ngumu kwenye pamoja kwenye taya.
Kuumia, kazi duni ya meno, ugonjwa wa ugonjwa wa mgongo, mkao mbaya, kurudiwa au kupiga ngumu kwa taya au kidevu,
whiplash, kutafuna gum, kunyonya kidole, kutafuna upande mmoja tu wa mdomo, au kushikilia simu
kati ya bega na taya.",yes
disease-musculoskeletal-muscle-cramps,Muscle Cramps,"(Muscle Pain, Leg Cramps; Charley Horse)
SYMPTOMS—A pain in a body muscle, most often in the legs (especially the calf muscles) or feet.
CAUSES—Muscle cramps may occur at any age. Between the ages of 15 to 80, a full 50% of people
will, at some time, have pain or cramps in the legs. Leg pains in children are frequent enough that they
are called ""growing pains.""
Reduced blood supply to the legs is part of the problem. Another is an imbalance in the levels of calcium
and magnesium in the body or a deficiency of vitamin E.
But other causes have also been noted: arthritis, anemia, tobacco usage, inactivity, poor circulation, too
much or too little exercise, muscle injury, allergy, fibromyalgia, arteriosclerosis, dehydration,
hypothyroidism, heat stroke, and varicose veins. Diuretic drugs for heart problems, or hypertension can
also induce cramps. Those who have had part of the stomach removed tend to have muscle cramps
thereafter.
If cramping occurs when walking and stops when you cease, it may be impaired circulation and nothing
more.
If leg cramps occur during pregnancy, they may be caused by hormone changes, fatigue, uterine
pressure, chilling, or muscle tenseness.
A calcium deficiency can make the leg muscles trigger-happy; the contractions in the muscles are
stronger.
Leg cramps in older people may be caused by arteriosclerotic changes in the circulatory system. Turn to
the articles on heart and blood vessels, and see your physician. Vitamin E (600-800 IU daily) is very
helpful.
IMMEDIATE TREATMENT—
• Massage the muscles and use heat to relieve pain.
• A heating pad may be applied to the area. For some, alternate hot and cold compresses
work better (heat for 6 minutes and cold for 30 seconds, with 4 changes).
• Drink peppermint tea and apply it as an external compress.
• Pinch the upper lip between the thumb and index finger, and hold for 20-30 seconds till
the cramping disappears.
• If you are pregnant and cramping occurs, push the toes upward while applying pressure
to the knee, to flatten the affected part.
• Here is the strangest advice of all: The next day, repeat the activity that made you sore.
Do it with much less intensity. This will help work out the soreness. Thereafter, follow
this hard/easy routine; for it takes 48 hours for the muscle to properly recover. This is how
serious athletes train.
• An alternate method is to vary activities, such as regular walking, with occasional biking
or swimming instead.
• After hard exercise or physical work, slow down instead of stopping suddenly. The
bloodstream is loaded with lactic acid; so slowly exercise at a relaxed pace while it drains
off. (However, that will not protect you from soreness the next day, resulting from torn
muscle fiber.)
• Perhaps you need to change into more comfortable shoes, in order to improve your leg
and foot problems.
ONGOING CARE—The blood circulation needs to be improved and equalized.
Drink enough water each day.
A common mistake is to drink water and take salt tablets during heated exercise. Instead, you need a full
range of electrolytes, and not so much sodium chloride. Drink fruit drinks. At mealtime, eat lots of fresh
fruits and vegetables. Include seaweed in your diet. Potassium broth (from thick white potato peelings)
is excellent.
A fat-free, sugar-free, salt-free diet improves the circulation.
Eat an abundance of green leafy vegetables, in order to improve the quality of the blood and the mineral
balance.
Alfalfa, brewer's yeast, and kelp are important.
A deficiency of calcium, potassium, selenium, and vitamin E exists.
Mineral imbalances can produce cramping. Be sure you are getting enough calcium through
supplementation. Otherwise the phosphorous in certain foods locks with it, so the calcium cannot be
absorbed. See ""Bones, Strengthening"" for more information on solving the calcium-phosphorous
problem.
Those with dentures, who find eating vegetables difficult, are especially prone to magnesium and
calcium deficiency and leg cramps. They should have vegetable soups, potassium broth, and raw
vegetable juices daily.
Every 3 hours, drink a large glass of quality water, to help clean the bloodstream, liver, kidneys, and
bowels of stored toxins.
Drink less whole milk
Eat your meals slowly and chew well.
Do not smoke. Nicotine greatly impedes blood circulation. Avoid second-hand smoke.
If you are taking diuretic drugs, take supplemental potassium. Better yet, switch to corn-silk tea and
other herbal diuretics; also drink more water (see the several articles on kidneys and urine).
Do not stand in one position for hours without moving. Some motion or shifting of body weight is vital.
Get off your feet for 5 minutes every hour. If possible, during that time, take your shoes off; massage
your feet and wiggle your toes.
Do not sit with crossed legs.
Stretch your legs every so often, with the feet flexed up, not down.
When sitting, try to elevate your feet every so often.
Do not wear garters or any binding clothes.
At night, wear roomy pajamas.
Keep the bed covers loose or use a foot cradle, to keep bedding weight off the feet. If you sleep on your
stomach, extend your feet over the edge of the bed. Another method is to sleep on your side, with your
legs bent and a pillow between your knees.
Rub olive or flaxseed oil into your muscles before and after strenuous exercise.
Twice a day, soak in a tub of warm water (100o-110o F.). Massage the toes, feet, and calves.
Here is an exercise which really helps stop ongoing lower leg cramps for many people: Stand with shoes
off, facing a wall 2-3 feet away. Lean forward, bracing against the wall with hands and arms, all the
while keeping your heels on the floor. When a moderate pull is felt in the calves, hold that position for
10 seconds.
Then stand straight for 5 seconds of rest, and lean forward and repeat. Do 3 stretching cycles.
If you are overweight, reduce to normal range or slightly below.
If leg cramps are caused by varicose veins or pregnancy, elevate the foot of the bed 9 inches.
If leg cramping occurs during pregnancy, take frequent rest periods with the feet elevated. Wear
comfortable, not tight, clothing. Be sure you are getting enough calcium; this is important.
—Also see ""Claudication,"" which has the same leg symptoms—but some very special, dangerous
causes. It also has additional information on improving the circulation of the legs.","(Maumivu ya misuli, tumbo; farasi wa Charley)
Dalili -maumivu katika misuli ya mwili, mara nyingi kwenye miguu (haswa misuli ya ndama) au miguu.
Sababu -Cramps nyingi zinaweza kutokea katika umri wowote. Kati ya umri wa miaka 15 hadi 80, watu 50 kamili wa watu
Je! Kwa wakati fulani, itakuwa na maumivu au maumivu kwenye miguu. Maumivu ya mguu kwa watoto ni ya kutosha mara kwa mara kwamba wao
huitwa ""maumivu yanayokua.""
Kupunguza usambazaji wa damu kwa miguu ni sehemu ya shida. Jingine ni usawa katika viwango vya kalsiamu
na magnesiamu katika mwili au upungufu wa vitamini E.
Lakini sababu zingine pia zimebainika: arthritis, anemia, matumizi ya tumbaku, kutokuwa na shughuli, mzunguko duni, pia
Zoezi kubwa au kidogo sana, kuumia kwa misuli, mzio, fibromyalgia, arteriosclerosis, upungufu wa maji mwilini,
Hypothyroidism, kiharusi cha joto, na mishipa ya varicose. Dawa za diuretic kwa shida za moyo, au shinikizo la damu zinaweza
Pia kushawishi cramps. Wale ambao wamekuwa na sehemu ya tumbo kuondolewa huwa na misuli ya misuli
baadaye.
Ikiwa cramping hufanyika wakati wa kutembea na kuacha wakati unakoma, inaweza kuwa duni na hakuna chochote
Zaidi.
Ikiwa tumbo la mguu linatokea wakati wa ujauzito, zinaweza kusababishwa na mabadiliko ya homoni, uchovu, uterine
shinikizo, baridi, au misuli ya misuli.
Upungufu wa kalsiamu unaweza kufanya misuli ya mguu trigger; Contractions kwenye misuli ni
Nguvu.
Matumbo ya mguu katika watu wazee yanaweza kusababishwa na mabadiliko ya arteriosclerotic katika mfumo wa mzunguko. Geuka
Nakala za mishipa ya moyo na damu, na kuona daktari wako. Vitamini E (600-800 IU kila siku) ni sana
inasaidia.
Matibabu ya haraka -
• Massage misuli na utumie joto kupunguza maumivu.
• Pedi ya kupokanzwa inaweza kutumika kwa eneo hilo. Kwa wengine, mbadala wa moto na baridi
Fanya kazi vizuri (joto kwa dakika 6 na baridi kwa sekunde 30, na mabadiliko 4).
• Kunywa chai ya peppermint na uitumie kama compress ya nje.
• Piga mdomo wa juu kati ya kidole na kidole cha index, na ushikilie kwa sekunde 20-30 mpaka
Cramping hupotea.
• Ikiwa wewe ni mjamzito na cramping hufanyika, kushinikiza vidole juu wakati wa kutumia shinikizo
kwa goti, kuburudisha sehemu iliyoathiriwa.
• Hapa kuna ushauri wa kushangaza wa wote: siku inayofuata, rudia shughuli iliyokufanya uchungu.
Fanya kwa nguvu kidogo. Hii itasaidia kutekeleza uchungu. Baada ya hapo, fuata
Utaratibu huu mgumu/rahisi; Kwa maana inachukua masaa 48 kwa misuli kupona vizuri. Hivi ndivyo
Wanariadha wakubwa wanafundisha.
Njia mbadala ni kutofautisha shughuli, kama vile kutembea mara kwa mara, na baiskeli mara kwa mara
au kuogelea badala yake.
• Baada ya mazoezi magumu au kazi ya mwili, punguza polepole badala ya kuacha ghafla.
Damu ya damu imejaa asidi ya lactic; Pole polepole mazoezi kwa kasi ya kupumzika wakati inavuta
mbali. (Walakini, hiyo haitakulinda kutokana na uchungu siku inayofuata, inayotokana na kung'olewa
nyuzi za misuli.)
• Labda unahitaji kubadilika kuwa viatu vizuri zaidi, ili kuboresha mguu wako
na shida za mguu.
Utunzaji unaoendelea -Mzunguko wa damu unahitaji kuboreshwa na kusawazishwa.
Kunywa maji ya kutosha kila siku.
Makosa ya kawaida ni kunywa maji na kuchukua vidonge vya chumvi wakati wa mazoezi moto. Badala yake, unahitaji kamili
Aina ya elektroni, na sio kloridi ya sodiamu sana. Kunywa vinywaji vya matunda. Wakati wa kula, kula safi
Matunda na mboga. Jumuisha mwani katika lishe yako. Mchuzi wa Potasiamu (kutoka kwa peelings nyeupe za viazi nyeupe)
ni bora.
Lishe isiyo na mafuta, isiyo na sukari, isiyo na chumvi huboresha mzunguko.
Kula mboga nyingi zenye majani mabichi, ili kuboresha ubora wa damu na madini
usawa.
Alfalfa, chachu ya Brewer, na kelp ni muhimu.
Upungufu wa kalsiamu, potasiamu, seleniamu, na vitamini E upo.
Kukosekana kwa usawa wa madini kunaweza kutoa cramping. Hakikisha unapata kalsiamu ya kutosha
nyongeza. Vinginevyo phosphorous katika vyakula fulani hufungia nayo, kwa hivyo kalsiamu haiwezi kuwa
kufyonzwa. Tazama ""Mifupa, Kuimarisha"" kwa habari zaidi juu ya kutatua kalsiamu-phosphorous
Tatizo.
Wale walio na meno, ambao huona kula mboga ni ngumu, wanakabiliwa na magnesiamu na
Upungufu wa kalsiamu na tumbo. Wanapaswa kuwa na supu za mboga, mchuzi wa potasiamu, na mbichi
juisi za mboga kila siku.
Kila masaa 3, kunywa glasi kubwa ya maji bora, kusaidia kusafisha damu, ini, figo, na
Matumbo ya sumu iliyohifadhiwa.
Kunywa maziwa kidogo
Kula chakula chako polepole na kutafuna vizuri.
Usivute moshi. Nikotini inazuia mzunguko wa damu. Epuka moshi wa mkono wa pili.
Ikiwa unachukua dawa za diuretic, chukua potasiamu ya ziada. Bora zaidi, badilisha kwa chai ya kunyoosha na
Diuretics zingine za mitishamba; Pia kunywa maji zaidi (angalia nakala kadhaa kwenye figo na mkojo).
Usisimame katika nafasi moja kwa masaa bila kusonga. Motion fulani au kuhama kwa uzito wa mwili ni muhimu.
Ondoka kwa miguu yako kwa dakika 5 kila saa. Ikiwezekana, wakati huo, ondoa viatu vyako; massage
Miguu yako na ubadilishe vidole vyako.
Usikae na miguu iliyovuka.
Kunyoosha miguu yako kila mara, na miguu ilibadilika, sio chini.
Unapokaa, jaribu kuinua miguu yako kila mara.
Usivae garters au nguo zozote za kumfunga.
Usiku, vaa pajamas za chumba.
Weka kitanda hufunika huru au utumie utoto wa mguu, kuweka uzito wa kitanda kutoka kwa miguu. Ukilala kwenye yako
tumbo, panua miguu yako juu ya makali ya kitanda. Njia nyingine ni kulala upande wako, na yako
Miguu iliyoinama na mto kati ya magoti yako.
Piga mafuta ya mizeituni au ya kitani ndani ya misuli yako kabla na baada ya mazoezi magumu.
Mara mbili kwa siku, loweka kwenye tub ya maji ya joto (100o-110o F.). Massage vidole, miguu, na ndama.
Hapa kuna zoezi ambalo husaidia sana kuacha matuta ya mguu wa chini unaoendelea kwa watu wengi: simama na viatu
mbali, inakabiliwa na ukuta umbali wa futi 2-3. Tegemea mbele, ukipiga ukuta dhidi ya mikono na mikono, yote
Wakati wa kuweka visigino vyako sakafuni. Wakati kuvuta wastani kunasikika katika ndama, shikilia msimamo huo kwa
Sekunde 10.
Kisha simama moja kwa moja kwa sekunde 5 za kupumzika, na tegemea mbele na kurudia. Fanya mizunguko 3 ya kunyoosha.
Ikiwa wewe ni mzito, punguza kwa kiwango cha kawaida au kidogo chini.
Ikiwa matundu ya mguu husababishwa na mishipa ya varicose au ujauzito, ongeza mguu wa kitanda inchi 9.
Ikiwa cramping ya mguu hufanyika wakati wa ujauzito, chukua vipindi vya kupumzika mara kwa mara na miguu iliyoinuliwa. Vaa
Vizuri, sio ngumu, mavazi. Hakikisha unapata kalsiamu ya kutosha; Hii ni muhimu.
-Unaona ""claudication,"" ambayo ina dalili za mguu sawa - lakini maalum sana, hatari
sababu. Pia ina habari ya ziada juu ya kuboresha mzunguko wa miguu.",yes
disease-musculoskeletal-muscle-injuries,Muscle Injuries,"TREATMENT
• According to one view, sprains should be treated with ice or very cold water. Follow this
by bandaging the injury with an Ace bandage.
• But, according to a different view, sprains should be initially treated with alternate hot
and cold—especially if it is in the wrist, elbow, or ankle. This method works better than
using cold alone!
• Put the injured part in very hot water, and keep it there 20-30 minutes. Every few
minutes take it out of the hot water and plunge it into cold water for about a minutes, then
back into the hot. Keep the hot water hot. This can continue for up to 2 hours with good
results.
• Repeat this for several days; and, twice a day, massage around the area.
• If you use the cold method alone on a sprain, you may not be able to walk on a sprained
ankle for days; use the alternate hot and cold method, and you may be much better in half
the time.
• (A third method calls for cold on strains to begin with, to reduce initial swelling,
followed by alternate hot and cold afterward.)
• If the sprain or strain is in the back or shoulder, treat it with hot fomentations, short cold,
and massage.
• A bad bruise on any part of the body can be treated as for a sprain or strain.
• In addition to the above, strains frequently require a cast similar to that used for a
fracture, so the injured joint area can be immobilized for more complete rest.
• DMSO (dimethyl sulfoxide) is a liquid that can be applied externally to the injured area,
to relieve pain, reduce swelling, and promote healing. But only buy it in the health food
store.
—Also see ""Athletic Workouts.""
(Sprains and Strains)
SYMPTOMS—Bruised wrists, ankles, fingers, knees, back, hips, and sore or swollen muscles.
CAUSES—Muscle injuries can occur when straining muscles too much, using them too long or hard,
suddenly twisting, or hard falls.
Athletes frequently have such problems.
Sprains are a painful stretching of ligaments of the joints, caused by lifting, sudden stops or turns,
injuries, or falls.
Strains are more severe; They involve torn ligaments and torn joint capsule, with bleeding and swelling.
The following suggestions are good both for prevention and treatment of injuries:","Matibabu
• Kulingana na maoni moja, sprains zinapaswa kutibiwa na barafu au maji baridi sana. Fuata hii
Kwa kufunga jeraha na bandage ya Ace.
• Lakini, kulingana na maoni tofauti, sprains zinapaswa kutibiwa hapo awali na moto mbadala
Na baridi -haswa ikiwa iko kwenye mkono, kiwiko, au kiwiko. Njia hii inafanya kazi vizuri kuliko
Kutumia baridi peke yako!
• Weka sehemu iliyojeruhiwa katika maji ya moto sana, na uweke hapo dakika 20-30. Kila wachache
Dakika huondoe kutoka kwa maji ya moto na uingie ndani ya maji baridi kwa dakika moja, basi
Rudi kwenye moto. Weka maji ya moto moto. Hii inaweza kuendelea hadi masaa 2 na nzuri
Matokeo.
• Rudia hii kwa siku kadhaa; Na, mara mbili kwa siku, massage kuzunguka eneo hilo.
• Ikiwa unatumia njia ya baridi peke yako kwenye sprain, unaweza kukosa kutembea kwenye sprainded
ankle kwa siku; Tumia njia mbadala ya moto na baridi, na unaweza kuwa bora zaidi katika nusu
wakati.
• (Njia ya tatu inahitaji baridi kwenye shida kuanza, kupunguza uvimbe wa awali,
ikifuatiwa na mbadala moto na baridi baadaye.)
• Ikiwa sprain au mnachuo uko nyuma au bega, uchukue na fomentations moto, baridi fupi,
na massage.
• Kuumiza vibaya kwa sehemu yoyote ya mwili kunaweza kutibiwa kama kwa sprain au shida.
• Mbali na hayo hapo juu, mara nyingi huhitaji kutupwa sawa na ile inayotumika kwa
Fracture, kwa hivyo eneo la pamoja la kujeruhiwa linaweza kubatilishwa kwa kupumzika kamili.
• DMSO (dimethyl sulfoxide) ni kioevu ambacho kinaweza kutumika nje kwa eneo lililojeruhiwa,
Ili kupunguza maumivu, kupunguza uvimbe, na kukuza uponyaji. Lakini ununue tu katika chakula cha afya
duka.
-Unaona ""mazoezi ya riadha.""
(Sprains na Matatizo)
Dalili - mikono iliyosababishwa, vijiti, vidole, magoti, nyuma, viuno, na misuli ya kidonda au kuvimba.
Sababu -majeraha mengi yanaweza kutokea wakati misuli inayopunguza sana, ikitumia kwa muda mrefu sana au ngumu,
Ghafla kupotosha, au maporomoko magumu.
Wanariadha mara nyingi huwa na shida kama hizo.
Sprains ni kunyoosha chungu ya mishipa ya viungo, inayosababishwa na kuinua, kuacha ghafla au zamu,
majeraha, au huanguka.
Matatizo ni kali zaidi; Zinahusisha mishipa iliyokatwa na kifusi cha pamoja, na kutokwa na damu na uvimbe.
Mapendekezo yafuatayo ni mazuri kwa kuzuia na matibabu ya majeraha:",yes
