id,title,contentEn,contentSw,needs_translation
disease-musculoskeletal-rheumatic-fever,Rheumatic Fever,"TREATMENT
• Give a nourishing diet, restricting all salt. Put on a water and fresh fruit and vegetable
juice diet. Eat no solid food until the fever subsides and joint pain is reduced. Then
maintain a light diet, including fresh fruits and vegetables, fruit juices, etc.
• Avoid caffeine, fried foods, soft drinks, processed or refined foods, sugar, or salt.
• Bioflavonoids are especially valuable in preventing and treating rheumatic fever.
• Bed rest is very important.
• While in bed, massage and mild exercise is helpful. A planned exercise program should
be undertaken later.
• Useful herbs include bayberry bark, goldenseal, yellow dock, pau d'arco, and burdock
root. Echinacea and dandelion are also good.
SYMPTOMS—Pain, inflammation, and stiffness in a large joint, such as the knee. These initial
symptoms are accompanied by pain.
The pain and swelling can travel from one joint to another. A skin rash may also appear.
CAUSES—Rheumatic fever is a streptococcal disease (Streptococcus Group A), and occurs between the
ages of 4 and 18. It tends to follow a bout with tonsillitis, scarlet fever, strep throat, or an ear infection;
most often strep throat (see ""Tonsillitis"")
After the disease appears ended, it may recur again later.
Rheumatic fever affects one or several body organs or locations: joints (arthritis), brain (chorea), tissues
(nodules), skin (erythema marginatum), or heart (carius). It may also result in residual heart disease,
producing permanent damage to one or more heart valves. (See ""Arthritis"" and ""Chorea."")
The residual heart valve damage is the most dangerous aspect of untreated rheumatic fever. Treatment
early in the course of the disease will generally prevent the heart damage. But this treatment may require
the help of a physician and a stay in the hospital. Here is supplementary information:","Matibabu
• Toa lishe yenye lishe, kuzuia chumvi yote. Vaa maji na matunda na mboga safi
lishe ya juisi. Kula hakuna chakula kigumu hadi homa itakapopungua na maumivu ya pamoja yamepunguzwa. Basi
Dumisha lishe nyepesi, pamoja na matunda na mboga mpya, juisi za matunda, nk.
• Epuka kafeini, vyakula vya kukaanga, vinywaji laini, vyakula vya kusindika au vilivyosafishwa, sukari, au chumvi.
• Bioflavonoids ni muhimu sana katika kuzuia na kutibu homa ya rheumatic.
• Kupumzika kitanda ni muhimu sana.
• Unapokuwa kitandani, mazoezi ya mazoezi na mazoezi laini ni muhimu. Programu ya mazoezi iliyopangwa inapaswa
kufanywa baadaye.
• Mimea muhimu ni pamoja na BayBerry Bark, Goldenseal, Dock ya Njano, Pau d'Arco, na Burdock
mzizi. Echinacea na dandelion pia ni nzuri.
Dalili -maumivu, uchochezi, na ugumu katika pamoja kubwa, kama goti. Hizi za awali
Dalili zinaambatana na maumivu.
Ma maumivu na uvimbe vinaweza kusafiri kutoka kwa pamoja kwenda kwa mwingine. Upele wa ngozi unaweza pia kuonekana.
Sababu -homa ya rheumatic ni ugonjwa wa streptococcal (kikundi cha Streptococcus A), na hufanyika kati ya
Umri wa 4 na 18. Inaelekea kufuata bout na tonsillitis, homa nyekundu, koo, au maambukizi ya sikio;
mara nyingi koo (tazama ""tonsillitis"")
Baada ya ugonjwa kuonekana kumalizika, inaweza kurudi tena baadaye.
Homa ya rheumatic huathiri viungo vya mwili mmoja au kadhaa au maeneo: viungo (arthritis), ubongo (chorea), tishu
(Nusu), ngozi (erythema marginatum), au moyo (carius). Inaweza pia kusababisha ugonjwa wa moyo uliobaki,
Kuzalisha uharibifu wa kudumu kwa valves moja au zaidi ya moyo. (Tazama ""Arthritis"" na ""Chorea."")
Uharibifu wa mabaki ya moyo ni sehemu hatari zaidi ya homa ya rheumatic isiyotibiwa. Matibabu
Mapema katika mwendo wa ugonjwa kwa ujumla utazuia uharibifu wa moyo. Lakini matibabu haya yanaweza kuhitaji
Msaada wa daktari na kukaa hospitalini. Hapa kuna habari ya ziada:",yes
