id,title,contentEn,contentSw,needs_translation
disease-musculoskeletal-backache,Backache,"TREATMENT
First, we will consider less serious back pain:
• The most common cause of backache is muscle strain. Rest will generally eliminate the
problem. Bed rest for 24 hours may be needed.
• Soaking in a tub of warm water may be quite relaxing to a strained back.
• For the first 72 hours after a back strain occurs, an 8-minute ice massage often helps.
Use ice cubes (or freeze water in a paper cup or frozen fruit- juice can). Massage the area
and about 6-8 inches around it.
• After 72 hours, use alternate hot and cold applications. Apply a wrung-out hot towel for
30 seconds, followed by brief cold. Do this 4-5 times.
• Ice packs are especially helpful in relieving muscles spasms.
• Moist heat reduces local inflammation and increases blood flow to the area.
• Some people think that staying in bed for a week will help back pain. This is not true. If
you remain in bed a week, it will take two weeks to rehabilitate.
• Stretching a sore back will tend to accelerate the healing process. Gently bring your
knees up from the bed and to your chest. Once there, put a little pressure on your knees.
Stretch, then relax. Do this again.
Preventive measures that will help you, either before or after experiencing back problems:
• Be very careful when lifting something. Take several deep breaths, to increase muscle
strength and then slowly lift with the legs, not the back, and hold the object close to your
body. Do not lift from a bending forward position (closing windows, lifting things from
deep in the car trunk).
• Keep the body warm and do not become overly fatigued. When the muscles are chilled
or you are exhausted, it is easier to injure joints because the muscles are not able to do the
work needed.
• Do not take a hot bath just before doing heavy exercise, for your muscles will be in a
weaker condition.
• Proper nutrition, including adequate amounts of calcium, minerals, vitamin D, etc. See
""Bones, Strengthening"" for much more on this.
Exercises, to build the muscles are very important, if you would avoid back trouble. More on this later in
this article.
• Walking and rowing are good for the back (walking is good for just about everything!).
• When sleeping, either a firm mattress should be used or a ¾-inch thick ply board should
be placed beneath the top mattress. Place 1-2 pillows under the knees to straighten the
lumbar curve. When lying on the side, flex the knees and place a pillow between them.
• Avoid sleeping on the stomach; it increases the swayback and twists the neck. This is
due to the fact that the trunk, being heavier, sinks farther into the bed, causing the back to
arch.
• It is reported that water beds, which do not make a lot of waves, may help people with
back trouble to sleep.
• When you get out of bed, roll out slowly and carefully. Do not sit straight up in bed.
• If you have back pain, slide to the edge of the bed. Then, keeping your back rigid, let
your legs off the bed first. That will act as a springboard, lifting your upper body up and
off the bed.
• Sit in a straight chair with a firm back. The knees should be higher than the hips; if
necessary, use a small footstool. Avoid soft sofas and stuffed chairs. Chair arms help
support the shoulders and upper back. Get up and move about every so often.
• When in a car, push the car seat forward, to raise the knees higher than the hips. This
lessens back and shoulder strain. Use safety belts.
• Look for a car with adjustable lumbar support, and adjust the support down as low as it
goes. Then, if necessary, raise it a notch or two.
• Do not stand in one position for long periods.
• High-heeled shoes will bring trouble sooner or later. Women should wear low-heeled
shoes if they want to protect their pelvic organs and spine.
• Good posture when sitting, standing, or walking should be the goal.
Exercises to strengthen the back:
• Do press-ups which are half a push-up. Lie on the floor, on your stomach. Keep your
pelvis flat on the floor and push up with your hands, arching your back as you lift your
shoulders off the floor. This will help strengthen your lower back.
• Do floor swimming. Lay on your stomach on the floor. Raise your left arm and right leg.
Hold for one second, then alternate with the right arm and left leg. Go back and forth. This
extends and strengthens the lower back.
• Do a crunch sit-up. Lay on your back on the floor, with knees flexed and feet flat on the
floor. Cross your arms with your hands on your shoulders. Raise your head and shoulders
off the floor as high as you can while keeping your lower back on the floor. Hold for one
second, then repeat.
• Know your limit when exercising. If you feel fine 1-2 days after exercising, then it is
safe to continue them.
• Spinal surgery: Should you have a back operation? Sometimes the problem is so serious
that a back operation is necessary. But, if at all possible, try to avoid having one. Not only
are they expensive, but frequently do not solve your movement and pain problems. It is an
intriguing fact that, according to U.S. government reports, only 1% of those with back
pain obtains relief from back surgery. And there is always the possibility that the
operation will only result in greater pain, more serious damage, and even less mobility.
But, after weighing all the possibilities, you may still decide to undergo it.
—Also see ""Sciatica.""
(Low Back Pain; Sciatica; Slipped Disk; Lumbar Disk
Herniation; Spinal Disk Prolapse)
SYMPTOMS—Pain in the back, frequently in the lower back.
If pain comes after lifting something heavy, after coughing, or after unusually heavy exercise, and the
pain prevents you from moving or shoots down one leg, you may have a herniated disk.
CAUSES—Backache, or pain felt in the spinal column, is one of the most common reasons for
hospitalization in the Western world. Your spinal column has a complicated interconnection of muscles,
tendons, bones, and ligaments.
It is helpful to identify the various parts of the spine, also called the vertebrae (singular is vertebra): The
top part of the spine, where the neck is located, is called the cervical spine (or cervicals); the shoulder
and mid-part (which protrudes outward in an adult) is called the thoracic; the lower portion (called the
hollow of the back) is the lumbar; and the bottom part (ending in the tailbone or coccyx) is the sacrum.
The first cervical is the atlas. This enables your head to tilt up or down. The second is the axis; it permits
your head to turn from side to side.
Aches and pains in the lower back can be a chronic problem. This pain can be in the spine or it can be in
the sacroiliac. The sacroiliac joint connects (articulates is the correct word) the spine to the pelvic bone.
(There can also be pain in the muscles of the lower back; it is called lumbago.)
A subluxation occurs when two vertebrae get out of proper alignment with one another. A chiropractor
puts these back in place for relatively little cost.
Sciatica is chronic pain in the sciatic nerve, which is the largest nerve in the body. This nerve, which
passes down through the upper leg, can experience neuralgia and neuritis as a result of a pinched nerve
in the lumbar region. If the problem is not solved, eventually the leg where the pain is may no longer
receive nerve signals from the brain or the central nervous system.
The intervertebral disks (also spelled discs) are made of cartilage and act as cushions between the
vertebrae. Each disk has a tough, fibrous, outer layer surrounding a soft interior, which provides the
cushioning.
Lumbar disk herniation and lumbar disk prolapse occur when the disk herniates (ruptures or breaks) and
some of this soft inner disk material pushes outward against the spinal cord to one degree or another.
This may be very serious; and, like sciatica, it can lead to muscle wasting, reduced nerve reflexes, and
muscle weakness. Disk herniation and prolapse are often erroneously referred to as a ""slipped disk.""
Causes of lower-back pain include wrenched or damaged muscles, bones, tendons, or ligaments, Kidney
or bladder infection, prostate problems, or female pelvic disorders may cause backache. Overeating,
overdrinking, eating the wrong kinds of food, and constipation can also be involved. The spinal bones,
and muscles attached to them, are weakened by wrong habits. Chronic conditions causing back pain
include arthritis, bone disease, or abnormal curvature of the spine (scoliosis).
Other causes of back pain are poor posture, walking habits, improper shoes, lifting, straining, calcium
deficiency, slouching when sitting, or soft mattresses.
There is a definite relationship between smoker's cough and severe back pain. Injecting the nicotine
equivalent of one cigarette decidedly reduced the measured blood flow in the vertebral body. It is also
thought that using tobacco interferes with the elasticity of connective tissue.
A small percentage of lower-back pain may be linked to flat feet.
Sometimes a serious case of constipation will cause an ache in the back, from impacted stools or
pressure from gas.
(More rarely, back pain can result from congenital abnormalities, metabolic disorders, cancer, or
referred syndromes.)
The back pain can also be the result of an excess of lactic acid in the muscles, following muscular
exercise. Drinking enough water helps lessen this problem.
Where can you go to get help with your bad back? There are lots of experts out there:
Chiropractors adjust the back by pushing and thrusting. They also recommend nutritional and lifestyle
changes. In 1994, the U.S. Agency for Health Care Policy and Research issued a report, that
chiropractors generally provided the most effective treatments for acute back pain. They cost far less, do
the job quicker, and do not give medicinal drugs (most of which are usually poisonous). The British
Medical Journal reported that chiropractic treatments proved more successful than hospital treatments in
nearly every way.
X rays are generally considered a routine part of back pain diagnosis; yet only a few back conditions
show up on x rays! If the pain is caused by muscle strain or a herniated disk, an x ray will not reveal
anything because muscles, disks, and ligaments are all soft tissues. Beware of x rays if you are pregnant.
Orthopedic surgeons are another source of help. These are medical doctors who also do back surgery,
they are very likely to recommend it—and that is something you want to avoid, if at all possible.
Osteopaths can prescribe drugs and do surgery also, but they are less likely to do so.
Physiatrists, also called doctors of physical medicine, are also medical doctors. They have a good record
of helping to solve serious back problems (such as disk problems) without resorting to surgery (which
they are not licensed to do). They recommend lifestyle changes, back braces, etc.
Physical therapists try to restore muscle strength and joint and spine mobility.
Which back pains are the most serious?
Back pain that comes on suddenly, for no apparent reason.
Back pain that is accompanied by other symptoms, such as fever, stomach cramps, chest pain, or
difficult breathing.
An acute attack of back pain that lasts more than 2-3 days, without any relief.
Chronic pain which lasts more than 2 weeks.
Pain in the back which radiates down the leg to the knee or foot.","Matibabu
Kwanza, tutazingatia maumivu mazito ya mgongo:
• Sababu ya kawaida ya maumivu ya mgongo ni shida ya misuli. Kupumzika kwa ujumla kutaondoa
Tatizo. Kupumzika kitanda kwa masaa 24 kunaweza kuhitajika.
• Kuingiza kwenye tub ya maji ya joto kunaweza kuwa kupumzika kabisa kwa mgongo uliokuwa na shida.
• Kwa masaa 72 ya kwanza baada ya shida ya nyuma kutokea, massage ya barafu ya dakika 8 mara nyingi husaidia.
Tumia cubes za barafu (au kufungia maji kwenye kikombe cha karatasi au juisi ya matunda waliohifadhiwa). Massage eneo hilo
na karibu inchi 6-8 kuzunguka.
• Baada ya masaa 72, tumia matumizi mbadala ya moto na baridi. Omba kitambaa cha moto kilichochomwa kwa
Sekunde 30, ikifuatiwa na homa fupi. Fanya hii mara 4-5.
• Pakiti za barafu zinasaidia sana kupunguza spasms za misuli.
• Joto la unyevu hupunguza uchochezi wa ndani na huongeza mtiririko wa damu kwenye eneo hilo.
• Watu wengine wanafikiria kuwa kukaa kitandani kwa wiki moja kutasaidia maumivu nyuma. Hii sio kweli. Ikiwa
Unabaki kitandani kwa wiki, itachukua wiki mbili kurekebisha.
• Kunyoosha mgongo kunaweza kuharakisha mchakato wa uponyaji. Upole kuleta yako
magoti juu kutoka kitandani na kwa kifua chako. Mara tu huko, weka shinikizo kidogo juu ya magoti yako.
Kunyoosha, kisha kupumzika. Fanya hii tena.
Hatua za kuzuia ambazo zitakusaidia, kabla au baada ya kupata shida za nyuma:
• Kuwa mwangalifu sana wakati wa kuinua kitu. Chukua pumzi kadhaa za kina, kuongeza misuli
nguvu na kisha kuinua polepole na miguu, sio nyuma, na ushikilie kitu karibu na yako
mwili. Usiinue kutoka kwa nafasi ya mbele (kufunga madirisha, kuinua vitu kutoka
ndani ya shina la gari).
• Weka mwili joto na usiwe na uchovu mwingi. Wakati misuli imejaa
au umechoka, ni rahisi kuumiza viungo kwa sababu misuli haiwezi kufanya
kazi inahitajika.
• Usioga moto kabla tu ya kufanya mazoezi mazito, kwa kuwa misuli yako itakuwa katika
hali dhaifu.
• Lishe sahihi, pamoja na kiwango cha kutosha cha kalsiamu, madini, vitamini D, nk Tazama
""Mifupa, kuimarisha"" kwa mengi zaidi juu ya hii.
Mazoezi, kujenga misuli ni muhimu sana, ikiwa ungeepuka shida ya nyuma. Zaidi juu ya hii baadaye ndani
Nakala hii.
• Kutembea na kuweka safu ni nzuri kwa nyuma (kutembea ni nzuri kwa kila kitu!).
• Unapolala, ama godoro thabiti inapaswa kutumiwa au bodi ya ply ya inchi inapaswa
kuwekwa chini ya godoro la juu. Weka mito 1-2 chini ya magoti ili kunyoosha
curve lumbar. Wakati umelala upande, bonyeza magoti na uweke mto kati yao.
• Epuka kulala juu ya tumbo; Inaongeza swayback na inapotosha shingo. Hii ni
Kwa sababu ya ukweli kwamba shina, kuwa mzito, huzama zaidi kitandani, na kusababisha mgongo kwa
Arch.
• Inaripotiwa kuwa vitanda vya maji, ambavyo havifanyi mawimbi mengi, vinaweza kusaidia watu walio na
nyuma shida kulala.
• Unapotoka kitandani, toa polepole na kwa uangalifu. Usikae moja kwa moja kitandani.
• Ikiwa una maumivu ya mgongo, tembea kwa makali ya kitanda. Halafu, kuweka mgongo wako mgumu, wacha
Miguu yako kwanza kitandani. Hiyo itafanya kama ubao wa mwili, kuinua mwili wako wa juu na
mbali na kitanda.
• Kaa katika kiti kilicho sawa na nyuma ya kampuni. Magoti yanapaswa kuwa ya juu kuliko viuno; ikiwa
Muhimu, tumia kiti kidogo cha miguu. Epuka sofa laini na viti vilivyojaa. Silaha za Mwenyekiti Msaada
Kusaidia mabega na nyuma ya juu. Amka na uende karibu kila mara.
• Unapokuwa kwenye gari, kushinikiza kiti cha gari mbele, kuinua magoti juu kuliko viuno. Hii
hupunguza nyuma na shida ya bega. Tumia mikanda ya usalama.
• Tafuta gari na msaada wa lumbar inayoweza kubadilishwa, na urekebishe msaada chini kama hiyo
huenda. Halafu, ikiwa ni lazima, inua notch au mbili.
• Usisimame katika nafasi moja kwa muda mrefu.
• Viatu vyenye visigino vya juu vitaleta shida mapema au baadaye. Wanawake wanapaswa kuvaa visigino vya chini
Viatu ikiwa wanataka kulinda viungo vyao vya pelvic na mgongo.
• Mkao mzuri wakati wa kukaa, kusimama, au kutembea unapaswa kuwa lengo.
Mazoezi ya kuimarisha mgongo:
• Fanya vyombo vya habari ambavyo ni nusu ya kushinikiza. Lala sakafuni, juu ya tumbo lako. Weka yako
Pelvis gorofa kwenye sakafu na kushinikiza juu na mikono yako, ukiweka mgongo wako unapoinua yako
mabega mbali na sakafu. Hii itasaidia kuimarisha mgongo wako wa chini.
• Fanya sakafu ya kuogelea. Weka juu ya tumbo lako sakafuni. Inua mkono wako wa kushoto na mguu wa kulia.
Shika kwa sekunde moja, kisha ubadilishe na mkono wa kulia na mguu wa kushoto. Rudi na kurudi. Hii
hupanua na kuimarisha mgongo wa chini.
• Fanya kukaa-up. Lala mgongoni mwako kwenye sakafu, na magoti yamebadilika na miguu gorofa kwenye
sakafu. Vuka mikono yako na mikono yako juu ya mabega yako. Inua kichwa na mabega yako
mbali na sakafu juu kama unavyoweza wakati wa kuweka nyuma yako chini kwenye sakafu. Shikilia moja
Pili, kisha rudia.
• Jua kikomo chako wakati wa mazoezi. Ikiwa unajisikia vizuri siku 1-2 baada ya kufanya mazoezi, basi ni
Salama ya kuendelea nao.
• Upasuaji wa mgongo: Je! Unapaswa kuwa na operesheni ya nyuma? Wakati mwingine shida ni mbaya sana
Kwamba operesheni ya nyuma ni muhimu. Lakini, ikiwa inawezekana, jaribu kuzuia kuwa na moja. Sio tu
Je! Ni ghali, lakini mara nyingi usisuluhishe harakati zako na shida za maumivu. Ni
Ukweli wa kushangaza kwamba, kulingana na ripoti za serikali ya Merika, 1% tu ya wale walio na mgongo
Maumivu hupata unafuu kutoka kwa upasuaji wa nyuma. Na kila wakati kuna uwezekano kwamba
Operesheni itasababisha tu maumivu makubwa, uharibifu mkubwa zaidi, na hata uhamaji mdogo.
Lakini, baada ya kupima uwezekano wote, bado unaweza kuamua kuipitia.
-Unaona ""Sciatica.""
(Maumivu ya nyuma ya chini; sciatica; diski iliyoteleza; diski ya lumbar
Herniation; Prolapse ya Diski ya mgongo)
Dalili -mgongo nyuma, mara kwa mara nyuma ya chini.
Ikiwa maumivu yanakuja baada ya kuinua kitu kizito, baada ya kukohoa, au baada ya mazoezi mazito, na
Ma maumivu hukuzuia kusonga au kutikisa mguu mmoja, unaweza kuwa na diski ya herniated.
Sababu -kurudi nyuma, au maumivu yaliyohisi kwenye safu ya mgongo, ni moja ya sababu za kawaida za
Hospitali katika Ulimwengu wa Magharibi. Safu yako ya mgongo ina unganisho ngumu wa misuli,
Tendons, mifupa, na mishipa.
Ni muhimu kutambua sehemu mbali mbali za mgongo, pia huitwa vertebrae (umoja ni vertebra): The
Sehemu ya juu ya mgongo, ambayo shingo iko, inaitwa mgongo wa kizazi (au kizazi); bega
na sehemu ya katikati (ambayo inajitokeza nje kwa mtu mzima) inaitwa thoracic; sehemu ya chini (inayoitwa
mashimo ya nyuma) ni lumbar; na sehemu ya chini (kuishia kwenye mkia au coccyx) ni sacrum.
Cervical ya kwanza ni Atlas. Hii inawezesha kichwa chako kusonga juu au chini. Ya pili ni mhimili; inaruhusu
Kichwa chako kugeuka kutoka upande hadi upande.
Aches na maumivu katika mgongo wa chini inaweza kuwa shida sugu. Maumivu haya yanaweza kuwa kwenye mgongo au inaweza kuwa ndani
Sacroiliac. Viunga vya pamoja vya sacroiliac (vifungu ni neno sahihi) mgongo kwa mfupa wa pelvic.
(Kunaweza pia kuwa na maumivu katika misuli ya mgongo wa chini; inaitwa lumbago.)
Subluxation hufanyika wakati vertebrae mbili zinatoka kwa maelewano sahihi na mtu mwingine. Chiropractor
Huweka hizi mahali kwa gharama kidogo.
Sciatica ni maumivu sugu katika ujasiri wa kisayansi, ambayo ni ujasiri mkubwa zaidi katika mwili. Ujasiri huu, ambao
hupita chini ya mguu wa juu, inaweza kupata neuralgia na neuritis kama matokeo ya ujasiri uliowekwa
katika mkoa wa lumbar. Ikiwa shida haijatatuliwa, mwishowe mguu ambapo maumivu hayawezi tena
Pokea ishara za ujasiri kutoka kwa ubongo au mfumo mkuu wa neva.
Diski za intervertebral (pia rekodi zilizoandikwa) zinafanywa kwa cartilage na hufanya kama matakia kati ya
vertebrae. Kila diski ina safu ngumu, ya nyuzi, ya nje inayozunguka mambo ya ndani laini, ambayo hutoa
mto.
Lumbar disk herniation na lumbar disk prolapse kutokea wakati diski herniates (kupasuka au mapumziko) na
Baadhi ya nyenzo hii laini ya diski ya ndani inasukuma nje dhidi ya kamba ya mgongo kwa kiwango kimoja au kingine.
Hii inaweza kuwa mbaya sana; Na, kama sciatica, inaweza kusababisha kupoteza misuli, kupunguzwa kwa mishipa, na
udhaifu wa misuli. Disk herniation na prolapse mara nyingi hujulikana kama ""diski iliyoteremka.""
Sababu za maumivu ya chini ni pamoja na misuli iliyoharibika au iliyoharibiwa, mifupa, tendons, au mishipa, figo
au maambukizo ya kibofu cha mkojo, shida za kibofu, au shida ya pelvic ya kike inaweza kusababisha maumivu ya mgongo. Kuongeza kupita kiasi,
Kupindukia, kula aina mbaya ya chakula, na kuvimbiwa pia kunaweza kuhusika. Mifupa ya mgongo,
na misuli iliyowekwa nao, imedhoofishwa na tabia mbaya. Hali sugu husababisha maumivu ya mgongo
Jumuisha ugonjwa wa arthritis, ugonjwa wa mfupa, au curvature isiyo ya kawaida ya mgongo (scoliosis).
Sababu zingine za maumivu ya mgongo ni mkao duni, tabia za kutembea, viatu visivyofaa, kuinua, kusumbua, kalsiamu
Upungufu, kupungua wakati umekaa, au godoro laini.
Kuna uhusiano dhahiri kati ya kikohozi cha wavutaji sigara na maumivu makali ya mgongo. Kuingiza nikotini
Sawa na sigara moja iliamua kupunguza mtiririko wa damu uliopimwa katika mwili wa vertebral. Pia ni
Nilidhani kwamba kutumia tumbaku huingiliana na elasticity ya tishu zinazojumuisha.
Asilimia ndogo ya maumivu ya chini-nyuma yanaweza kuhusishwa na miguu ya gorofa.
Wakati mwingine kesi kubwa ya kuvimbiwa itasababisha maumivu nyuma, kutoka kwa viti vilivyoathiriwa au
shinikizo kutoka kwa gesi.
(Mara chache zaidi, maumivu ya mgongo yanaweza kusababisha ugonjwa wa kuzaliwa, shida za kimetaboliki, saratani, au
syndromes zilizorejelewa.)
Ma maumivu ya nyuma pia yanaweza kuwa matokeo ya asidi ya lactic kwenye misuli, kufuatia misuli
Zoezi. Kunywa maji ya kutosha husaidia kupunguza shida hii.
Unaweza kwenda wapi kupata msaada na mgongo wako mbaya? Kuna wataalam wengi huko nje:
Takwimu za chiropractors hurekebisha nyuma kwa kusukuma na kusukuma. Pia zinapendekeza lishe na mtindo wa maisha
mabadiliko. Mnamo 1994, Shirika la Utunzaji wa Afya la Merika na Utafiti lilitoa ripoti, kwamba
Chiropractors kwa ujumla walitoa matibabu bora zaidi kwa maumivu ya nyuma ya papo hapo. Zinagharimu kidogo, fanya
Kazi haraka, na haitoi dawa za dawa (nyingi ambazo kawaida ni sumu). Waingereza
Jarida la Matibabu liliripoti kuwa matibabu ya chiropractic yalithibitisha kufanikiwa zaidi kuliko matibabu ya hospitalini katika
Karibu kila njia.
Mionzi x kwa ujumla huchukuliwa kuwa sehemu ya utambuzi wa maumivu ya mgongo; Bado hali chache za nyuma
Onyesha kwenye mionzi ya x! Ikiwa maumivu yanasababishwa na shida ya misuli au diski ya herniated, ray ya X haitafunua
Chochote kwa sababu misuli, diski, na mishipa yote ni tishu laini. Jihadharini na mionzi ya x ikiwa una mjamzito.
Madaktari wa upasuaji wa mifupa ni chanzo kingine cha msaada. Hao ni madaktari wa matibabu ambao pia hufanya upasuaji wa nyuma,
Wana uwezekano mkubwa wa kuipendekeza - na hiyo ni kitu unachotaka kuzuia, ikiwa inawezekana kabisa.
Osteopaths inaweza kuagiza dawa na kufanya upasuaji pia, lakini wana uwezekano mdogo wa kufanya hivyo.
Wanasaikolojia, pia huitwa madaktari wa dawa za mwili, pia ni madaktari wa matibabu. Wana rekodi nzuri
ya kusaidia kutatua shida kubwa za nyuma (kama shida za diski) bila kuamua upasuaji (ambayo
hawana leseni ya kufanya). Wanapendekeza mabadiliko ya mtindo wa maisha, braces za nyuma, nk.
Wataalam wa mwili hujaribu kurejesha nguvu ya misuli na uhamaji wa pamoja na mgongo.
Je! Ni maumivu gani ya mgongo ambayo ni makubwa zaidi?
Ma maumivu ya nyuma ambayo huja ghafla, bila sababu dhahiri.
Ma maumivu ya nyuma ambayo yanaambatana na dalili zingine, kama vile homa, tumbo, maumivu ya kifua, au
Kupumua ngumu.
Shambulio kali la maumivu ya mgongo ambayo huchukua zaidi ya siku 2-3, bila utulivu wowote.
Ma maumivu sugu ambayo hudumu zaidi ya wiki 2.
Ma maumivu nyuma ambayo huangaza chini ya mguu hadi goti au mguu.",yes
